{
  "hardware_id": "gamry_1010b",
  "manufacturer": "Gamry Instruments",
  "model": "Interface 1010B",
  "capabilities": {
    "max_current_a": 1.0,
    "min_current_a": 1e-12,
    "max_potential_v": 11.0,
    "min_potential_v": -11.0,
    "eis": {"frequency_range_hz": [1e-5, 1e6], "max_amplitude_v": 0.5},
    "techniques": ["ocp", "cv", "lsv", "ca", "cp", "eis", "dpv", "swv", "cc"],
    "features": ["ir_compensation"]
  }
}
