{
  "hardware_id": "mock",
  "manufacturer": "ecproc",
  "model": "Mock Potentiostat",
  "capabilities": {
    "max_current_a": 1000,
    "min_current_a": 1e-15,
    "max_potential_v": 100,
    "min_potential_v": -100,
    "eis": {"frequency_range_hz": [1e-9, 1e9], "max_amplitude_v": 10},
    "techniques": ["ocp", "cv", "lsv", "ca", "cp", "eis", "dpv", "swv", "gcd", "cc", "stripping", "purge"],
    "features": ["ir_compensation", "autoranging"]
  }
}
